{
  "recordType": "member",
  "schemaVersion": 1,
  "githubUsername": "teammate-vision",
  "roles": [
    "vision"
  ],
  "responsibilities": [
    "占位账号：请替换为第三位队员的真实 GitHub username"
  ],
  "status": "inactive",
  "createdAt": "2026-07-29T10:00:00+08:00",
  "updatedAt": "2026-07-29T10:00:00+08:00"
}
